;When this bit is set, the MAC attempts only 1 transmission. When a collision occurs on the MII, the MAC ignores the current frame transmission and reports a Frame Abort with excessive collision error in the transmit frame status.
;When this bit is reset, the MAC attempts retries based on the settings of BL.
8 Reserved;This field is reserved.
;This read-only field is reserved and always has the value 0.
7 APCS;Automaticpad/CRCstripping
;When this bit is set, the MAC strips the Pad/FCS field on incoming frames only if the length’s field value is less than or equal to 1 500 bytes. All received frames with length field greater than or equal to 1 501 bytes are passed on to the application without stripping the Pad/FCS field.
;When this bit is reset, the MAC passes all incoming frames unmodified.
6-5 BL;Back-offlimit
;The Back-off limit determines the random integer number (r) of slot time delays (4 096 bit times for 1000 Mbit/s and 512 bit times for 10/100 Mbit/s) the MAC waits before rescheduling a transmission attempt during retries after a collision.
4 DC;Deferralcheck
;When this bit is set, the deferral check function is enabled in the MAC. The MAC issues a Frame Abort status, along with the excessive deferral error bit set in the transmit frame status when the transmit state machine is deferred for more than 24 288 bit times in 10/100- Mbit/s mode. Deferral begins when the transmitter is ready to transmit, but is prevented because of an active CRS (carrier sense) signal on the MII. Defer time is not cumulative. If the transmitter defers for 10 000 bit times, then transmits, collides, backs off, and then has to defer again after completion of back-off, the deferral timer resets to 0 and restarts.
;When this bit is reset, the deferral check function is disabled and the MAC defers until the CRS signal goes inactive. This bit is applicable only in Half-duplex mode.
3 TE;Transmitterenable
;When this bit is set, the transmit state machine of the MAC is enabled for transmission on the MII. When this bit is reset, the MAC transmit state machine is disabled after the completion of the transmission of the current frame, and does not transmit any further frames.
2 RE;Receiverenable
;When this bit is set, the receiver state machine of the MAC is enabled for receiving frames from the MII. When this bit is reset, the MAC receive state machine is disabled after the completion of the reception of the current frame, and will not receive any further frames from the MII.
1-0 Reserved;This field is reserved.
;This read-only field is reserved and always has the value 0.

ETH_MACFFR field descriptions;
31 RA;Receiveall
;When this bit is set, the MAC receiver passes all received frames on to the application, irrespective of whether they have passed the address filter. The result of the SA/DA filtering is updated (pass or fail) in the corresponding bits in the receive status word. When this bit is reset, the MAC receiver passes on to the application only those frames that have passed the SA/DA address filter.
30-11 Reserved;This field is reserved.
;This read-only field is reserved and always has the value 0.
10 HPF;Hash or perfectfilter
;When this bit is set and if the HM or HU bit is set, the address filter passes frames that match either the perfect filtering or the hash filtering.
;When this bit is cleared and if the HU or HM bit is set, only frames that match the Hash filter are passed.
9 SAF;Source address filter
;The MAC core compares the SA field of the received frames with the values programmed in the enabled SA registers. If the comparison matches, then the SAMatch bit in the RxStatus word is set high. When this bit is set high and the SA filter fails, the MAC drops the frame. When this bit is reset, the MAC core forwards the received frame to the application. It also forwards the updated SA Match bit in RxStatus depending on the SA address comparison.
8 SAIF;Source address inverse filtering
;When this bit is set, the address check block operates in inverse filtering mode for the SA address comparison. The frames whose SA matches the SA registers are marked as failing the SA address filter.
;When this bit is reset, frames whose SA does not match the SA registers are marked as failing the SA address filter.
7-6 PCF;Pass control frames
;These bits control the forwarding of all control frames (including unicast and multicast PAUSE frames). Note that the processing of PAUSE control frames depends only on RFCE in Flow Control register[2].
;00; MAC prevents all control frames from reaching the application
;01; MAC prevents all control frames from reaching the application
;10; MAC forwards all control frames to application even if they fail the address filter
;11; MAC forwards control frames that pass the address filter.
5 BFD;Broadcast frames disable
;When this bit is set, the address filters filter all incoming broadcast frames.
;When this bit is reset, the address filters pass all received broadcast frames.
4 PAM;Pass all multicast
;When set, this bit indicates that all received frames with a multicast destination address (first bit in the destination address field is '1') are passed.
;When reset, filtering of multicast frame depends on the HM bit.
3 DAIF;Destination address inverse filtering
;When this bit is set, the address check block operates in inverse filtering mode for the DA address comparison for both unicast and multicast frames.
;When reset, normal filtering of frames is performed.
2 HM;Hash multicast
;When set, MAC performs destination address filtering of received multicast frames according to the hash table.
;When reset, the MAC performs a perfect destination address filtering for multicast frames, that is, it compares the DA field with the values programmed in DA registers.
1 HU;Hash unicast
;When set, MAC performs destination address filtering of unicast frames according to the hash table.
;When reset, the MAC performs a perfect destination address filtering for unicast frames, that is, it compares the DA field with the values programmed in DA registers.
0 PM;Promiscuousmode
;When this bit is set, the address filters pass all incoming frames regardless of their destination or source address. The SA/DA filter fails status bits in the receive status word are always cleared when PM is set.