0x40028000;Ethernet MAC configuration register (ETH_MACCR);32;R/W;8000;
0x40028004;Ethernet MAC frame filter register (ETH_MACFFR);32;R/W;0000;
0x40028008;Ethernet MAC hash table high register (ETH_MACHTHR);32;R/W;0000;
0x4002800C;Ethernet MAC hash table low register (ETH_MACHTLR);32;R/W;0000;
0x40028010;Ethernet MAC MII address register (ETH_MACMIIAR);32;R/W;0000;
0x40028014;Ethernet MAC MII data register (ETH_MACMIIDR);32;R/W;0000;
0x40028018;Ethernet MAC flow control register (ETH_MACFCR);32;R/W;0000;
0x4002801C;Ethernet MAC VLAN tag register (ETH_MACVLANTR);32;R/W;0000;
0x40028028;Ethernet MAC remote wakeup frame filter register (ETH_MACRWUFFR);32;R/W;0000;
0x4002802C;Ethernet MAC PMT control and status register (ETH_MACPMTCSR);32;R/W;0000;
0x40028038;Ethernet MAC interrupt status register (ETH_MACSR);16;R;0000;
0x4002803C;Ethernet MAC interrupt mask register (ETH_MACIMR);16;R/W;0000;
0x40028040;Ethernet MAC address 0 high register (ETH_MACA0HR);32;R/W;8000FFFF;
0x40028044;Ethernet MAC address 0 low register (ETH_MACA0LR);32;R/W;FFFFFFFF;
0x40028048;Ethernet MAC address 1 high register (ETH_MACA1HR);32;R/W;0000FFFF;
0x4002804C;Ethernet MAC address 1 low register (ETH_MACA1LR);32;R/W;FFFFFFFF;
0x40028050;Ethernet MAC address 2 high register (ETH_MACA2HR);32;R/W;0000FFFF;
0x40028054;Ethernet MAC address 2 low register (ETH_MACA2LR);32;R/W;FFFFFFFF;
0x40028058;Ethernet MAC address 2 high register (ETH_MACA3HR);32;R/W;0000FFFF;
0x4002805C;Ethernet MAC address 2 low register (ETH_MACA3LR);32;R/W;FFFFFFFF;
0x40028100;Ethernet MMC control register (ETH_MMCCR);32;R/W;0000;
0x40028104;Ethernet MMC receive interrupt register (ETH_MMCRIR);32;R;0000;
0x40028108;Ethernet MMC transmit interrupt register (ETH_MMCTIR);32;R/W;0000;
0x4002810C;Ethernet MMC receive interrupt mask register (ETH_MMCRIMR);32;R/W;0000;
0x40028110;Ethernet MMC transmit interrupt mask register (ETH_MMCTIMR);32;R/W;0000;
0x4002814C;Ethernet MMC transmitted good frames after a single collision counter register (ETH_MMCTGFSCCR);32;R;0000;
0x40028150;Ethernet MMC transmitted good frames after more than a single collision counter register (ETH_MMCTGFMSCCR);32;R;0000;
0x40028168;Ethernet MMC transmitted good frames counter register (ETH_MMCTGFCR);32;R;0000;
0x40028194;Ethernet MMC received frames with CRC error counter register(ETH_MMCRFCECR);32;R;0000;
0x40028198;Ethernet MMC received frames with alignment error counter register (ETH_MMCRFAECR);32;R;0000;
0x400281C4;Ethernet MMC received good unicast frames counter register (ETH_MMCRGUFCR);32;R;0000;
0x40028700;Ethernet PTP time stamp control register (ETH_PTPTSCR);32;R/W;0000;
0x40028704;Ethernet PTP subsecond increment register (ETH_PTPSSIR);32;R/W;0000;
0x40028708;Ethernet PTP time stamp high register (ETH_PTPTSHR);32;R;0000;
0x4002870C;Ethernet PTP time stamp low register (ETH_PTPTSLR);32;R;0000;
0x40028710;Ethernet PTP time stamp high update register (ETH_PTPTSHUR);32;R/W;0000;
0x40028714;Ethernet PTP time stamp low update register (ETH_PTPTSLUR);32;R/W;0000;
0x40028718;Ethernet PTP time stamp addend register (ETH_PTPTSAR);32;R/W;0000;
0x4002871C;Ethernet PTP target time high register (ETH_PTPTTHR);32;R/W;0000;
0x40028720;Ethernet PTP target time low register (ETH_PTPTTLR);32;R/W;0000;
0x40029000;Ethernet DMA bus mode register (ETH_DMABMR);32;R/W;0;
0x40029004;Ethernet DMA transmit poll demand register (ETH_DMATPDR);32;R/W;0;
0x40029008;Ethernet DMA receive poll demand register (ETH_DMARPDR);32;R/W;0;
0x4002900C;Ethernet DMA receive descriptor list address register (ETH_DMARDLAR);32;R/W;0;
0x40029010;Ethernet DMA transmit descriptor list address register (ETH_DMATDLAR);32;R/W;0;
0x40029014;Ethernet DMA status register (ETH_DMASR);32;R/W;0;
0x40029018;Ethernet DMA operation mode register (ETH_DMAOMR);32;R/W;0;
0x4002901C;Ethernet DMA interrupt enable register (ETH_DMAIER);32;R/W;0;
0x40029020;Ethernet DMA missed frame and buffer overflow counter register (ETH_DMAMFBOCR);32;R/W;0;
0x40029048;Ethernet DMA current host transmit descriptor register (ETH_DMACHTDR);32;R/W;0;
0x4002904C;Ethernet DMA current host receive descriptor register (ETH_DMACHRDR);32;R/W;0;
0x40029050;Ethernet DMA current host transmit buffer address register (ETH_DMACHTBAR);32;R/W;0;
0x40029054;Ethernet DMA current host receive buffer address register (ETH_DMACHRBAR);32;R/W;0;

ETH_DMACHRBAR field descriptions;
31-0 HRBAP;Hostreceivebufferaddresspointer
;Cleared On Reset. Pointer updated by DMA during operation.


ETH_DMACHTBAR field descriptions;
31-0 HTBAP;Hosttransmitbufferaddresspointer
;Cleared On Reset. Pointer updated by DMA during operation.


ETH_DMACHRDR field descriptions;
31-0 HRDAP;Hostreceivedescriptoraddresspointer
;Cleared On Reset. Pointer updated by DMA during operation.

ETH_DMACHTDR field descriptions;
31-0 HTDAP;Hosttransmitdescriptoraddresspointer Cleared . Pointer updated by DMA during operation.


ETH_DMAMFBOCR field descriptions;
31-29 Reserved;This field is reserved.
;This read-only field is reserved and always has the value 0.
28 OFOC;Overflow bit for FIFO overflow counter
27-17 MFA; Missed frames by the application
;Indicates the number of frames missed by the application
16 OMFC;Overflow bit for missed frame counter 
15-0 MFC;Missed frames by the controller
;Indicates the number of frames missed by the Controller due to the host receive buffer being unavailable. This counter is incremented each time the DMA discards an incoming frame.

ETH_DMAIER field descriptions;
31-17 Reserved;This field is reserved.
;This read-only field is reserved and always has the value 0.
16 NISE;Normal interrupt summary enable
;When this bit is set, a interrupt is enabled. When this bit is cleared, a normal interrupt is disabled. This bit enables the following bits:
15 AISE;Abnormal interrupt summary enable
;When this bit is set, an interrupt is enabled. When this bit is cleared, an abnormal interrupt is disabled. This bit enables the following bits:
14 ERIE;Early receive interrupt enable
;When this bit is set with the normal interrupt summary enable bit (NISE), the ERS is enabled.
;When this bit is cleared, the early receive interrupt is disabled.
13 FBEIE;Fatalbuserror interrupt enable
;When this bit is set with the abnormal interrupt summary enable bit (AISE), the FBES is enabled.
;When this bit is cleared, the fatal bus error enable interrupt is disabled.
12-11 Reserved;This field is reserved.
;This read-only field is reserved and always has the value 0.
10 ETIE;Earlytransmit interrupt enable
;When this bit is set with the abnormal interrupt summary enable bit (AISE), the ETS is enabled.
;When this bit is cleared, the early transmit interrupt is disabled.
9 RWTIE;receivewatchdogtimeout interrupt enable
;When this bit is set with the abnormal interrupt summary enable bit (AISE), the RWTS interrupt is enabled.
;When this bit is cleared, the receive watchdog timeout interrupt is disabled.
8 RPSIE;Receiveprocessstopped interrupt enable
;When this bit is set with the abnormal interrupt summary enable bit (AISE), the RPSS is enabled. When this bit is cleared, the receive stopped interrupt is disabled.
7 RBUIE;Receivebufferunavailable interrupt enable
;When this bit is set with the abnormal interrupt summary enable bit (AISE), the RBUS interrupt is enabled.
;When this bit is cleared, the receive buffer unavailable interrupt is disabled.
6 RIE;Receive interrupt enable
;When this bit is set with the normal interrupt summary enable bit (NISE), the RS interrupt is enabled.
;When this bit is cleared, the receive interrupt is disabled.
5 TUIE;Underflow interrupt enable
;When this bit is set with the abnormal interrupt summary enable bit (AISE), the TUS interrupt is enabled.
;When this bit is cleared, the underflow interrupt is disabled.
4 ROIE; Overflow interrupt enable
;When this bit is set with the abnormal interrupt summary enable bit (AISE), the ROS interrupt is enabled.
;When this bit is cleared, the overflow interrupt is disabled.
3 TJTIE;Transmitjabbertimeout interrupt enable
;When this bit is set with the abnormal interrupt summary enable bit (AISE), the TJTS interrupt is enabled.
;When this bit is cleared, the transmit jabber timeout interrupt is disabled.
2 TBUIE;Transmitbufferunavailable interrupt enable
;When this bit is set with the normal interrupt summary enable bit (NISE), the TBUS interrupt is enabled.
;When this bit is cleared, the transmit buffer unavailable interrupt is disabled.
1 TPSIE;Transmitprocessstopped interrupt enable
;When this bit is set with the abnormal interrupt summary enable bit (AISE), the TPSS interrupt is enabled.
;When this bit is cleared, the transmission stopped interrupt is disabled.
0 TIE;Transmit interrupt enable
;When this bit is set with the normal interrupt summary enable bit (NISE), the TS interrupt is enabled.
;When this bit is cleared, the transmit interrupt is disabled.

ETH_DMAOMR field descriptions;
31-27 Reserved;This field is reserved.
;This read-only field is reserved and always has the value 0.
26 DTCEFD;DroppingofTCP/IPchecksumerrorframesdisable
;When this bit is set, the core does not drop frames that only have errors detected by the receive checksum offload engine. Such frames do not have any errors (including FCS error) in the Ethernet frame received by the MAC but have errors in the encapsulated payload only. When this bit is cleared, all error frames are dropped if the FEF bit is reset.
25 RSF;Receivestoreandforward
;When this bit is set, a frame is read from the Rx FIFO after the complete frame has been written to it, ignoring RTC bits. When this bit is cleared, the Rx FIFO operates in Cut-through mode, subject to the threshold specified by the RTC bits.
24 DFRF;Disableflushingofreceivedframes
;When this bit is set, the RxDMA does not flush any frames due to the unavailability of receive descriptors/buffers as it does normally when this bit is cleared (see Receive process suspended).
23-22 Reserved;This field is reserved.
;This read-only field is reserved and always has the value 0.
21 TSF;Transmitstoreandforward
;When this bit is set, transmission starts when a full frame resides in the Transmit FIFO. When this bit is set, the TTC values specified by the ETH_DMAOMR register bits [16:14] are ignored.
20 FTF;FlushtransmitFIFO
;When this bit is set, the transmit FIFO controller logic is reset to its default values and thus all data in the Tx FIFO are lost/flushed. This bit is cleared internally when the flushing operation is complete. The Operation mode register should not be written to until this bit is cleared.
19-17 Reserved;This field is reserved.
;This read-only field is reserved and always has the value 0.
16-14 TTC;Transmit threshold control
;These three bits control the threshold level of the Transmit FIFO. Transmission starts when the frame size within the Transmit FIFO is larger than the threshold. In addition, full frames with a length less than the threshold are also transmitted. These bits are used only when the TSF bit (Bit 21) is cleared.
13 ST;Start/stoptransmission
;When this bit is set, transmission is placed in the Running state, and the DMA checks the transmit list at the current position for a frame to be transmitted. Descriptor acquisition is attempted either from the current position in the list, which is the transmit list base address set by the ETH_DMATDLAR register, or from the position retained when transmission was stopped previously. If the current descriptor is not owned by the DMA, transmission enters the Suspended state and the transmit buffer unavailable bit (ETH_DMASR [2]) is set. The Start Transmission command is effective only when transmission is stopped. If the command is issued before setting the DMA ETH_DMATDLAR register, the DMA behavior is unpredictable.
;When this bit is cleared, the transmission process is placed in the Stopped state after completing the transmission of the current frame. The next descriptor position in the transmit list is saved, and becomes the current position when transmission is restarted. The Stop Transmission command is effective only when the transmission of the current frame is complete or when the transmission is in the Suspended state.
12-8 Reserved;This field is reserved.
;This read-only field is reserved and always has the value 0.
7 FEF;Forward error frames
;When this bit is set, all frames except runt error frames are forwarded to the DMA.
;When this bit is cleared, the Rx FIFO drops frames with error status (CRC error, collision error, giant frame, watchdog timeout, overflow). However, if the frame’s start byte (write) pointer is already transferred to the read controller side (in Threshold mode), then the frames are not dropped. The Rx FIFO drops the error frames if that frame's start byte is not transferred (output) on the ARI bus.
6 FUGF;Forward under sized good frames
;When this bit is set, the Rx FIFO forwards undersized frames (frames with no error and length less than 64 bytes) including pad-bytes and CRC).
;When this bit is cleared, the Rx FIFO drops all frames of less than 64 bytes, unless such a frame has already been transferred due to lower value of receive threshold (e.g., RTC = 01).
5 Reserved;This field is reserved.
;This read-only field is reserved and always has the value 0.
4-3 RTC;Receivethresholdcontrol
;These two bits control the threshold level of the Receive FIFO. Transfer (request) to DMA starts when the frame size within the Receive FIFO is larger than the threshold. In addition, full frames with a length less than the threshold are transferred automatically.
2 OSF;Operate on second frame
;When this bit is set, this bit instructs the DMA to process a second frame of Transmit data even before status for first frame is obtained.
1 SR;Start/stopreceive
;When this bit is set, the receive process is placed in the Running state. The DMA attempts to acquire the descriptor from the receive list and processes incoming frames. Descriptor acquisition is attempted from the current position in the list, which is the address set by the DMA ETH_DMARDLAR register or the position retained when the receive process was previously stopped. If no descriptor is owned by the DMA, reception is suspended and the receive buffer unavailable bit (ETH_DMASR [7]) is set. The Start Receive command is effective only when reception has stopped. If the command was issued before setting the DMA ETH_DMARDLAR register, the DMA behavior is unpredictable.
;When this bit is cleared, RxDMA operation is stopped after the transfer of the current frame. The next descriptor position in the receive list is saved and becomes the current position when the receive process is restarted. The Stop Receive command is effective only when the Receive process is in either the Running (waiting for receive packet) or the Suspended state.
0 Reserved;This field is reserved.
;This read-only field is reserved and always has the value 0.

ETH_DMASR field descriptions;
31-30 Reserved;This field is reserved.
;This read-only field is reserved and always has the value 0.
29 TSTS;Timestamp trigger status
;This bit indicates an interrupt event in the MAC core's Time stamp generator block. The software must read the MAC core’s status register, clearing its source (bit 9), to reset this bit to 0. When this bit is high an interrupt is generated if enabled.
28 PMTS;PMT status
;This bit indicates an event in the MAC core’s PMT. The software must read the corresponding registers in the MAC core to get the exact cause of interrupt and clear its source to reset this bit to 0. The interrupt is generated when this bit is high if enabled.
27 MMCS;MMC status
;This bit reflects an event in the MMC of the MAC core. The software must read the corresponding registers in the MAC core to get the exact cause of interrupt and clear the source of interrupt to make this bit as 0. The interrupt is generated when this bit is high if enabled.
26 Reserved;This field is reserved.
;This read-only field is reserved and always has the value 0.
25-23 EBS;Error bits status
;These bits indicate the type of error that caused a bus error (error response on the AHB interface). Valid only with the fatal bus error bit (ETH_DMASR register [13]) set. This field does not generate an interrupt.
22-20 TPS;Transmit process state
;These bits indicate the Transmit DMA FSM state. This field does not generate an interrupt.
19-17 RPS;Receive process state
;These bits indicate the Receive DMA FSM state. This field does not generate an interrupt.
16 NIS;Normal interrupt summary
;if TS is 1,  NIS is 1.
;if TBUS is 1,  NIS is 1.
;if RS is 1,  NIS is 1.
;if ERS is 1,  NIS is 1.
;if TS is 0 and TBUS is 0 and RS is 0 and ERS is 0, NIS is zero.
;The normal interrupt summary bit value is the logical OR of the following when the corresponding interrupt bits are enabled in the ETH_DMAIER register:
;- ETH_DMASR [0]: Transmit interrupt
;- ETH_DMASR [2]: Transmit buffer unavailable
;- ETH_DMASR [6]: Receive interrupt
;- ETH_DMASR [14]: Early receive interrupt
;Only unmasked bits affect the normal interrupt summary bit.
;This is a sticky bit and it must be cleared (by writing a 1 to this bit) each time a corresponding bit that causes NIS to be set is cleared.
15 AIS;Abnormal interrupt summary
;if TPSS is 1,  NIS is 1.
;if TJTS is 1,  NIS is 1.
;if TUS is 1,  NIS is 1.
;if ROS is 1,  NIS is 1.
;if RBUS is 1,  NIS is 1.
;if RPSS is 1,  NIS is 1.
;if RWTS is 1,  NIS is 1.
;if ETS is 1,  NIS is 1.
;if FBES is 1,  NIS is 1.
;if TPSS is 0 and TJTS is 0 and TUS is 0 and ROS is 0 and RBUS is 0 and RPSS is 0 and RWTS is 0 and ETS is 0 and FBES is 0, NIS is zero.
;The abnormal interrupt summary bit value is the logical OR of the following when the
;corresponding interrupt bits are enabled in the ETH_DMAIER register:
;- ETH_DMASR [1]:Transmit process stopped
;- ETH_DMASR [3]:Transmit jabber timeout
;- ETH_DMASR [4]: Receive FIFO overflow
;- ETH_DMASR [5]: Transmit underflow
;- ETH_DMASR [7]: Receive buffer unavailable
;- ETH_DMASR [8]: Receive process stopped
;- ETH_DMASR [9]: Receive watchdog timeout
;- ETH_DMASR [10]: Early transmit interrupt
;- ETH_DMASR [13]: Fatal bus error
;Only unmasked bits affect the abnormal interrupt summary bit.
;This is a sticky bit and it must be cleared each time a corresponding bit that causes AIS to be set is cleared.
14 ERS;Early receive status
;This bit indicates that the DMA had filled the first data buffer of the packet. Receive Interrupt ETH_DMASR [6] automatically clears this bit.
13 FBES;Fatal bus error status
;This bit indicates that a bus error occurred, as detailed in [25:23]. When this bit is set, the corresponding DMA engine disables all its bus accesses.
12-11 Reserved;This field is reserved.
;This read-only field is reserved and always has the value 0.
10 ETS;Early transmit status
;This bit indicates that the frame to be transmitted was fully transferred to the Transmit FIFO.
9 RWTS; Receive watchdog timeout status
;This bit is asserted when a frame with a length greater than 2 048 bytes is received.
8 RPSS;Receive process stopped status
;This bit is asserted when the receive process enters the Stopped state.
7 RBUS;Receive buffer unavailable status
;This bit indicates that the next descriptor in the receive list is owned by the host and cannot be acquired by the DMA. Receive process is suspended. To resume processing receive descriptors, the host should change the ownership of the descriptor and issue a Receive Poll Demand command. If no Receive Poll Demand is issued, receive process resumes when the next recognized incoming frame is received. ETH_DMASR [7] is set only when the previous receive descriptor was owned by the DMA.
6 RS;Receive status
;This bit indicates the completion of the frame reception. Specific frame status information has been posted in the descriptor. Reception remains in the Running state.
5 TUS;Transmit underflow status
4 ROS;Receive overflow status
3 TJTS;Transmit jabber timeout status
;This bit indicates that the transmit jabber timer expired, meaning that the transmitter had been excessively active. The transmission process is aborted and placed in the Stopped state. This causes the transmit jabber timeout TDES0[14] flag to be asserted.
2 TBUS;Transmit buffer unavailable status
;This bit indicates that the next descriptor in the transmit list is owned by the host and cannot be acquired by the DMA. Transmission is suspended. Bits [22:20] explain the transmit process state transitions. To resume processing transmit descriptors, the host should change the ownership of the bit of the descriptor and then issue a Transmit Poll Demand command.
1 TPSS; Transmit process stopped status
;This bit is set when the transmission is stopped.
0 TS;Transmit status

ETH_DMATDLAR field descriptions;
31-0 STL;Start of transmit list
;This field contains the base address of the first descriptor in the transmit descriptor list. The LSB bits [1/2/3:0] for 32/64/128-bit bus width) are internally ignored and taken as all-zero by the DMA. Hence these LSB bits are read-only.


ETH_DMARDLAR field descriptions;
31-0 SRL;Start of receive list
;This field contains the base address of the first descriptor in the receive descriptor list. The LSB bits [1/2/3:0] for 32/64/128-bit bus width) are internally ignored and taken as all-zero by the DMA. Hence these LSB bits are read only.


ETH_DMARPDR field descriptions;
31-0 RPD;Receive poll demand
;When these bits are written with any value, the DMA reads the current descriptor pointed to by the ETH_DMACHRDR register. If that descriptor is not available (owned by Host), reception returns to the Suspended state and ETH_DMASR register bit 7 is not asserted. If the descriptor is available, the Receive DMA returns to active state.


ETH_DMATPDR field descriptions;
31-0 TPD;Transmit poll demand
;When these bits are written with any value, the DMA reads the current descriptor pointed to by the ETH_DMACHTDR register. If that descriptor is not available (owned by Host), transmission returns to the Suspend state and ETH_DMASR register bit 2 is asserted. If the descriptor is available, transmission resumes.

ETH_DMABMR field descriptions;
31-26 Reserved;This field is reserved.
;This read-only field is reserved and always has the value 0.
25 AAB;Address-alignedbeats
;When this bit is set high and the FB bit equals 1, the AHB interface generates all bursts aligned to the start address LS bits. If the FB bit equals 0, the first burst (accessing the data buffer’s start address) is not aligned, but subsequent bursts are aligned to the address.
24 FPM;4xPBLmode
;When set high, this bit multiplies the PBL value programmed (bits [22:17] and bits [13:8]) four times. Thus the DMA transfers data in a maximum of 4, 8, 16, 32, 64 and 128 beats depending on the PBL value.
23 USP;UseseparatePBL
;When set high, it configures the RxDMA to use the value configured in bits [22:17] as PBL while the PBL value in bits [13:8] is applicable to TxDMA operations only. When this bit is cleared, the PBL value in bits [13:8] is applicable for both DMA engines.
27-21 RDP;RxDMA PBL
;These bits indicate the maximum number of beats to be transferred in one RxDMA transaction. This is the maximum value that is used in a single block read/write operation. The RxDMA always attempts to burst as specified in RDP each time it starts a burst transfer on the host bus. RDP can be programmed with permissible values of 1, 2, 4, 8, 16, and 32. Any other value results in undefined behavior.
;These bits are valid and applicable only when USP is set high.
16 FB;Fixedburst
;This bit controls whether the AHB Master interface performs fixed burst transfers or not. When set, the AHB uses only SINGLE, INCR4, INCR8 or INCR16 during start of normal burst transfers. When reset, the AHB uses SINGLE and INCR burst transfer operations.
15-14 PM;RxTxpriorityratio
;RxDMA requests are given priority over TxDMA requests in the following ratio
13-8 BL;Programmableburstlength
;These bits indicate the maximum number of beats to be transferred in one DMA transaction.
;This is the maximum value that is used in a single block read/write operation. The DMA always attempts to burst as specified in PBL each time it starts a burst transfer on the host bus. PBL can be programmed with permissible values of 1, 2, 4, 8, 16, and 32. Any other value results in undefined behavior. When USP is set, this PBL value is applicable for TxDMA transactions only.
7 Reserved;This field is reserved.
;This read-only field is reserved and always has the value 0.
6-2 DSL;Descriptorskiplength
;This bit specifies the number of words to skip between two unchained descriptors. The address skipping starts from the end of current descriptor to the start of next descriptor. When DSL value equals zero, the descriptor table is taken as contiguous by the DMA, in Ring mode.
1 DA;DMAArbitration
;0; Round-robin with Rx:Tx priority given in bits [15:14] 
;1; Rx has priority over Tx
0 SR;Software reset
;When this bit is set, the MAC DMA controller resets all MAC Subsystem internal registers and logic. It is cleared automatically after the reset operation has completed in all of the core clock domains. Read a 0 value in this bit before re-programming any register of the core.


ETH_PTPTTLR field descriptions;
31-0 TTSL;Targettimestamplow
;This register stores the time in (signed) nanoseconds. When the value of the time stamp matches or exceeds both Target time stamp registers, the MAC, if enabled, generates an interrupt.

ETH_PTPTTHR field descriptions;
31-0 TTSH;Targettimestamphigh
;This register stores the time in seconds. When the time stamp value matches or exceeds both Target time stamp registers, the MAC, if enabled, generates an interrupt.

ETH_PTPTSAR field descriptions;
31-0 TSA;Time stamp addend
;This register indicates the 32-bit time value to be added to the Accumulator register to achieve time synchronization.

ETH_PTPTSLUR field descriptions;
31 TSUPNS;Timestamp update positive or negative sign
